Player_ID,Player_Name,Team_Abbr,Note,Date_Fetched
nfalyda01,N'Faly Dante,ATL,Day To Day (Concussion) - Dante did not play in Sunday's (Dec. 14) game against the 76ers.,2025-12-18
porzikr01,Kristaps Porziņģis,ATL,"Out (Reconditioning) - The Hawks announced Porzingis will miss the next two weeks and undergo further evaluations, sources tell ESPN.",2025-12-18
toppija01,Jacob Toppin,ATL,Day To Day (Shoulder) - Toppin did not play in Sunday's (Dec. 14) game against the 76ers.,2025-12-18
youngtr01,Trae Young,ATL,Day To Day (Knee) - The Hawks listed Young as Questionable for Thursdayâs (Dec.18) game against the Hornets.,2025-12-18
bouchch01,Chris Boucher,BOS,Day To Day (Illness) - Boucher did not play on Thursday's (Dec. 11) game against Milwaukee.,2025-12-18
harpero02,Ron Harper Jr.,BOS,Day To Day (Knee) - Harper Jr. did not play on Thursday's (Dec. 11) game against Milwaukee.,2025-12-18
tatumja01,Jayson Tatum,BOS,"Out (Achilles) - The Celtics have not ruled Tatum out for the 2025-26 season, ESPN's Shams Charania reported on the Pat McAfee Show on Thursday (Oct. 9).",2025-12-18
william01,Amari Williams,BOS,Day To Day (Hand) - Williams did not play on Thursday's (Dec. 11) game against Milwaukee.,2025-12-18
highsha01,Haywood Highsmith,BRK,"Out (Knee) - Highsmith experienced swelling during rehab recently and will be re-evaluated in eight weeks, per Brett Siegel of ClutchPoints.com.",2025-12-18
sarafbe01,Ben Saraf,BRK,Out (Illness) - The Nets listed Saraf as Out on Thursday's (Dec. 18) game against against Heat.,2025-12-18
thomaca02,Cam Thomas,BRK,Out (Hamstring) - The Nets said on Saturday (Dec. 6) that Thomas will miss at least 2 more weeks.,2025-12-18
ballla01,LaMelo Ball,CHO,Day To Day (Ankle) - The Hornets listed Ball as Questionable for Thursday's (Dec. 18) game against the Hawks.,2025-12-18
connapa01,Pat Connaughton,CHO,Out (Calf) - The Hornets listed Connaughton on as Out for Thursday's (Dec. 18) game against the Hawks.,2025-12-18
manntr01,Tre Mann,CHO,Out (Ankle) - The Hornets listed Mann on as Out for Thursday's (Dec. 18) game against the Hawks.,2025-12-18
sextoco01,Collin Sexton,CHO,Out (Thigh) - The Hornets listed Sexton as Out for Thursday's (Dec. 18) game against the Hawks.,2025-12-18
willigr01,Grant Williams,CHO,Out (ACL) - The Hornets listed Williams as Out for Thursday's (Dec. 18) game against the Hawks.,2025-12-18
dosunay01,Ayo Dosunmu,CHI,Day To Day (Thumb) - Dosunmu did not play on Wednesday's (Dec. 17) game against Cleveland.,2025-12-18
essenno01,Noa Essengue,CHI,"Out For Season (Shoulder) - The Bulls reported on Wednesday (Dec. 3) that Essengue will have shoulder surgery and miss the remainder of the season, per HC Billy Donovan.",2025-12-18
merrisa01,Sam Merrill,CLE,Day To Day (Hand) - Merrill did not play on Wednesday's (Dec. 17) game against the Bulls.,2025-12-18
mobleev01,Evan Mobley,CLE,Out (Calf) - The Cavaliers reported on Saturday (Dec. 13) that Mobley is expected to miss 2-4 weeks due to a Grade 1 left calf strain.,2025-12-18
nancela02,Larry Nance Jr.,CLE,Out (Calf) - The Cavaliers reported Nance Jr. to miss at least 3-4 weeks with a calf strain.,2025-12-18
strusma01,Max Strus,CLE,"Out (Foot) - Strus is no longer wearing a walking boot Tuesday (Sept. 30) but still has a lengthy recovery process ahead due to the surgery on his fractured left foot, per Chris Fedor of The Cleveland Plain Dealer.",2025-12-18
davisan02,Anthony Davis,DAL,Day To Day (Calf) - The Mavericks listed Davis as Questionable on Thursday's (Dec. 18) game against the Pistons.,2025-12-18
exumda01,Dante Exum,DAL,Out For Season (Knee) - The Mavericks announced on Friday (Nov. 21) that Exum will undergo season-ending knee surgery.,2025-12-18
irvinky01,Kyrie Irving,DAL,Out (Knee) - The Mavericks said on Monday (Sept. 29) that Irving is ahead of schedule in his left ACL recovery but there's no timeline on his return yet.,2025-12-18
livelde01,Dereck Lively II,DAL,Out For Season (Foot) - The Mavericks announced on Wednesday (Dec. 10) that Lively II will undergo season-ending foot surgery.,2025-12-18
russeda01,D'Angelo Russell,DAL,Day To Day (Illness) - The Mavericks listed Russell as Questionable on Thursday's (Dec. 18) game against the Pistons.,2025-12-18
willibr03,Brandon Williams,DAL,Day To Day (Achilles) - The Mavericks listed Williams as Questionable on Thursday's (Dec. 18) game against the Pistons.,2025-12-18
braunch01,Christian Braun,DEN,"Out (Ankle) - Christian Braun will be re-evaluated in six weeks after suffering a left ankle sprain during Wednesday's (Nov. 12) win over the Clippers, Shams Charania of ESPN reports.",2025-12-18
gordoaa01,Aaron Gordon,DEN,"Out (Hamstring) - Gordon is not expected to return before Christmas, according to Vinny Benedetto of The Denver Gazette reports.",2025-12-18
hardati02,Tim Hardaway Jr.,DEN,Day To Day (Illness) - The Nuggets listed Hardaway Jr. as Questionable on Thurday's (Dec. 18) game versus the Magic.,2025-12-18
watsope01,Peyton Watson,DEN,Day To Day (Side) - The Nuggets listed Watson as Questionable on Thurday's (Dec. 18) game versus the Magic.,2025-12-18
jonesis01,Isaac Jones,DET,Day To Day (Knee) - Jones did not play on Friday's (Dec. 12) game against the Hawks.,2025-12-18
horfoal01,Al Horford,GSW,Out (Back) - The Warriors listed Horford as Out for Thursday's (Dec. 18) game against the Suns.,2025-12-18
spencpa01,Pat Spencer,GSW,Out (Personal) - The Warriors listed Spencer as Out for Thursday's (Dec. 18) game against the Suns.,2025-12-18
easonta01,Tari Eason,HOU,Day To Day (Oblique) - The Rockets listed Eason as Questionable on Thursday's (Dec. 18) game against the Pelicans.,2025-12-18
finnedo01,Dorian Finney-Smith,HOU,"Out (Ankle) - The Rockets are eyeing January for Finney-Smith to make his season debut, Michael Shapiro of SI.com reports.",2025-12-18
vanvlfr01,Fred VanVleet,HOU,"Out For Season (ACL) - The Rockets said on Monday (Sept. 22) that VanVleet suffered a torn ACL and may be out for the entire 2025-26 campaign, per Shams Charania of ESPN.",2025-12-18
halibty01,Tyrese Haliburton,IND,Out For Season (Achilles) - The Pacers confirmed that Haliburton will miss the 2025-2026 season as he recovers from a torn Achilles.,2025-12-18
nesmiaa01,Aaron Nesmith,IND,"Out (Knee) - Nesmith is expected to be out for around four weeks, Dustin Dopirak of The Indianapolis Star reports.",2025-12-18
sheppbe01,Ben Sheppard,IND,Day To Day (Calf) - The Pacers listed Sheppard as Doubtful onn Thursday's (Dec.18) game against the Knicks.,2025-12-18
toppiob01,Obi Toppin,IND,Out (Foot) - The Pacers announced that Toppin will undergo foot surgery and miss at least three months.,2025-12-18
bealbr01,Bradley Beal,LAC,"Out For Season (Hip) - Beal will undergo season-ending surgery on his left hip, as per ESPN's Shams Charania reports.",2025-12-18
hardeja01,James Harden,LAC,Out (Calf) - The Clippers listed Harden as Out on Thursday's (Dec. 18) game against the Thunder.,2025-12-18
jonesde02,Derrick Jones Jr.,LAC,Out (Knee) - The Clippers said Jones Jr. to miss at least 6 weeks with sprained MCL.,2025-12-18
konanya01,Yanic Konan Niederhäuser,LAC,Out (Knee) - The Clippers listed Niederhauser as Out on Thursday's (Dec. 18) game against the Thunder.,2025-12-18
aytonde01,Deandre Ayton,LAL,Out (Elbow) - The Lakers listed Ayton as Out on Thursday's (Dec. 18) game against the Jazz.,2025-12-18
klebima01,Maxi Kleber,LAL,Day To Day (Back) - The Lakers listed Kleber as Probable on Thursday's (Dec. 18) game against the Jazz.,2025-12-18
reaveau01,Austin Reaves,LAL,"Out (Calf) - Reaves has been diagnosed with a mild left calf strain and will be re-evaluated in approximately one week, as reported by Dan Woike of The Athletic.",2025-12-18
vincega01,Gabe Vincent,LAL,Day To Day (Back) - The Lakers listed Vincent as Questionable on Thursday's (Dec. 18) game against the Jazz.,2025-12-18
edeyza01,Zach Edey,MEM,"Out (Ankle) - Edey will be re-evaluated in about four weeks, as per Shams Charania of ESPN.",2025-12-18
jeromty01,Ty Jerome,MEM,Out (Calf) - The Grizzlies said on Saturday (Nov. 22) that Jerome is expected to make his season debut within 6-9 weeks.,2025-12-18
konchjo01,John Konchar,MEM,Out (Thumb) - The Grizzlies announced Konchar underwent a successful procedure to repair a UCL tear in his left thumb. He is expected to make a full recovery and will be reevaluated in approximately three weeks.,2025-12-18
moranja01,Ja Morant,MEM,Day To Day (Ankle) - Morant did not play on Wednesday's (Dec. 17) game against Minnesota.,2025-12-18
pippesc02,Scotty Pippen Jr.,MEM,Out (Toe) - The Grizzlies announced on Saturday (Oct. 18) that Pippen Jr. will undergo a procedure on his left big toe injury and will be re-evaluated in 12 weeks.,2025-12-18
smallja01,Javon Small,MEM,"Out (Toe) - The Grizzlies announced on Thursday (Dec. 11) that Small is expected to miss at least three more weeks, per Brett Siegel of ClutchPoints.com.",2025-12-18
spencca01,Cam Spencer,MEM,Day To Day (Personal) - Spencer did not play on Wednesday's (Dec. 17) game against Minnesota.,2025-12-18
herroty01,Tyler Herro,MIA,Out (Toe) - The Heat listed Herro as Out on Thursday's (Dec. 18) game against the Nets.,2025-12-18
jovicni01,Nikola Jović,MIA,Out (Elbow) - The Heat said on Wednesday (Dec. 17) that Jovic is expected to miss at least 1 week.,2025-12-18
larsspe01,Pelle Larsson,MIA,Out (Ankle) - The Heat listed Larsson as Out on Thursday's (Dec. 18) game against the Nets.,2025-12-18
powelno01,Norman Powell,MIA,Day To Day (Calf) - The Heat listed Powell as Questionable on Thursday's (Dec. 18) game against the Nets.,2025-12-18
antetgi01,Giannis Antetokounmpo,MIL,"Out (Calf) - Antetokounmpo is expected to be sidelined for two-to-four weeks, as per ESPN's Shams Charania reports.",2025-12-18
anthoco01,Cole Anthony,MIL,Day To Day (Neck) - The Bucks listed Anthony as Questionable on Thursday's (Dec.18) game against the Raptors.,2025-12-18
greenaj01,A.J. Green,MIL,Day To Day (Shoulder) - The Bucks listed Green as Questionable on Thursday's (Dec.18) game against the Raptors.,2025-12-18
kuzmaky01,Kyle Kuzma,MIL,Day To Day (Illness) - The Bucks listed Kuzma as Questionable on Thursday's (Dec.18) game against the Raptors.,2025-12-18
princta02,Taurean Prince,MIL,Out (Neck) - The Team announce that Prince underwent surgery Thursday (Nov. 13) to repair the herniated disc in his neck and will remain out indefinitely.,2025-12-18
conlemi01,Mike Conley,MIN,Day To Day (Achilles) - Conley did not play on Wednesday's (Dec. 17) game against the Grizzlies.,2025-12-18
edwaran01,Anthony Edwards,MIN,Day To Day (Foot) - Edwards did not play on Wednesday's (Dec. 17) game against the Grizzlies.,2025-12-18
murrade01,Dejounte Murray,NOP,Out (Leg) - The Pelicans said on Thursday (Sept. 25) that Murray could return right after New Year's.,2025-12-18
anunoog01,OG Anunoby,NYK,Day To Day (Knee) - The Knicks listed Anunoby as Questionable for Thursday's (Dec. 18) game against the Pacers.,2025-12-18
hartjo01,Josh Hart,NYK,Day To Day (Ankle) - The Knicks listed Hart as Questionable for Thursday's (Dec. 18) game against the Pacers.,2025-12-18
mcbrimi01,Miles McBride,NYK,"Out (Ankle) - McBride will be re-evaluated in one week, according to Kristian Winfield of the New York Daily News reports.",2025-12-18
robinmi01,Mitchell Robinson,NYK,Day To Day (Ankle) - The Knicks listed Robinson as Questionable for Thursday's (Dec. 18) game against the Pacers.,2025-12-18
shamela01,Landry Shamet,NYK,"Out (Shoulder) - Shamet will be re-evaluated in four weeks, Shams Charania of ESPN reports.",2025-12-18
townska01,Karl-Anthony Towns,NYK,Day To Day (Knee) - The Knicks listed Towns as Questionable for Thursday's (Dec. 18) game against the Pacers.,2025-12-18
harteis01,Isaiah Hartenstein,OKC,Out (Foot) - The Thunder listed Hartenstein as Out on Thursday's (Dec. 18) game against the Clippers.,2025-12-18
sorbeth01,Thomas Sorber,OKC,Out For Season (Knee) - The Thunder announced on Friday (Sept. 5) that Sorber will miss the 2025-2026 season with a torn ACL.,2025-12-18
topicni01,Nikola Topić,OKC,Out (Groin) - The Thunder announced that Topic is dealing with testicular cancer and there is no timetable for his return.,2025-12-18
willija07,Jaylin Williams,OKC,Out (Foot) - The Thunder listed Williams as Out on Thursday's (Dec. 18) game against the Clippers.,2025-12-18
castlco01,Colin Castleton,ORL,Out (Thumb) - The Magic listed Castleton as Out on Thursday's (Dec. 18) game versus the Nuggets.,2025-12-18
dasiltr01,Tristan Da Silva,ORL,Day To Day (Shoulder) - The Magic listed da Silva as Questionable on Thursday's (Dec. 18) game versus the Nuggets.,2025-12-18
suggsja01,Jalen Suggs,ORL,"Out (Hip) - Suggs was diagnosed with a left hip contusion following an MRI on Monday (Dec. 15), as per Ohm Youngmisuk of ESPN.com reports.",2025-12-18
wagnefr01,Franz Wagner,ORL,"Out (Leg) - Wagner was diagnosed with a high left ankle sprain Monday (Dec. 8) and could miss two-to-four weeks, as per ESPN's Shams Charania.",2025-12-18
wagnemo01,Moritz Wagner,ORL,"Out (Knee) - HC Mosley said that Wagner won't be available during Orlando's upcoming four-game road trip, according to Jason Beede of the Orlando Sentinel.",2025-12-18
maxeyty01,Tyrese Maxey,PHI,Day To Day (Illness) - Maxey did not play in Sunday's (Dec. 14) game against the Hawks.,2025-12-18
oubreke01,Kelly Oubre Jr.,PHI,"Out (Knee) - Oubre will miss at least two weeks, Tony Jones of The Athletic reports.",2025-12-18
sallihu01,Hunter Sallis,PHI,Day To Day (Shoulder) - Sallis did not play in Sunday's (Dec. 14) game against the Hawks.,2025-12-18
watfotr01,Trendon Watford,PHI,"Out (Thigh) - Watford will be re-evaluated in two weeks, according to Noah Levick of NBC Sports Philadelphia reports.",2025-12-18
allengr01,Grayson Allen,PHO,Day To Day (Knee) - The Suns listed Allen as Questionable on Thursday's (Dec. 18) game against the Warriors.,2025-12-18
greenja05,Jalen Green,PHO,"Out (Hamstring) - Green will be re-evaluated in four-to-six weeks, as per Shams Charania of ESPN reports.",2025-12-18
liveris01,Isaiah Livers,PHO,Day To Day (Hip) - The Suns listed Livers as Questionable on Thursday's (Dec. 18) game against the Warriors.,2025-12-18
hendesc01,Scoot Henderson,POR,Out (Hamstring) - The Trail Blazers announced Friday (Nov. 21) that Henderson will be re-evaluated in 2-4 weeks.,2025-12-18
holidjr01,Jrue Holiday,POR,Out (Calf) - The Trail Blazers listed Holiday as Out on Thursday's (Dec. 14) game against the Kings.,2025-12-18
lillada01,Damian Lillard,POR,Out For Season (Achilles) - The Trail Blazers said on Thursday (Sept. 25) that Lillard won't be back on the court for the 2025-26 season due to his achilles injury.,2025-12-18
thybuma01,Matisse Thybulle,POR,Out (Thumb) - The Trail Blazers announced on Monday (Dec. 1) that Thybulle remains to be OUT indefinitely.,2025-12-18
weslebl01,Blake Wesley,POR,"Out (Foot) - Wesley underwent a successful procedure to repair a fracture of the fifth metatarsal base in his right foot Wednesday (Nov. 5), and he's expected to be sidelined for 8-12 weeks, per Brett Siegel of ClutchPoints.com.",2025-12-18
eubandr01,Drew Eubanks,SAC,Out (Thumb) - The Kings listed Eubanks as Out on Thursday's (Dec. 18) game against the Timberwolves.,2025-12-18
lavinza01,Zach LaVine,SAC,"Out (Ankle) - The Kings announced on Tuesday (Dec. 16) that LaVine will be re-evaluated in one week, as reported by Jason Anderson of The Sacramento Bee.",2025-12-18
sabondo01,Domantas Sabonis,SAC,"Out (Knee) - Sacramento Kings star center Domantas Sabonis has suffered a partially torn meniscus in his left knee and will be re-evaluated in 3-to-4 weeks, per Shams Charania of ESPN.",2025-12-18
schrode01,Dennis Schröder,SAC,Day To Day (Ankle) - The Kings listed Schroder as Questionable on Thursday's (Dec. 18) game against the Trail Blazers.,2025-12-18
barrerj01,RJ Barrett,TOR,"Out (Knee) - Barrett will sidelined for at least one more week following a PRP injection, as per Josh Lewenberg of TSN.ca reports.",2025-12-18
kesslwa01,Walker Kessler,UTA,"Out For Season (Shoulder) - Kessler will undergo left shoulder surgery to address a torn labrum and will miss the remainder of the 2025-26 season, as per Tony Jones of The Athletic.",2025-12-18
kesslwa01,Walker Kessler,UTA,Out (Shoulder) - The Jazz listed Kessler as Out on Thursday's (Dec. 18) game against the Lakers.,2025-12-18
markkla01,Lauri Markkanen,UTA,Day To Day (Groin) - The Jazz listed Markkanen as Questionable on Thursday's (Dec. 18) game against the Lakers.,2025-12-18
niangge01,Georges Niang,UTA,Out (Foot) - The Jazz announced Monday (Dec. 15) that Niang will be re-evaluated in two weeks.,2025-12-18
branhma01,Malaki Branham,WAS,Day To Day (Thumb) - The Wizards listed Branham as Questionable on Thursday's (Dec. 18) game against the Spurs.,2025-12-18
kispeco01,Corey Kispert,WAS,Out (Thumb) - The Wizards listed Kispert as Out on Thursday's (Dec. 18) game against the Spurs.,2025-12-18
middlkh01,Khris Middleton,WAS,Out (Knee) - The Wizards listed Middleton as Out on Thursday's (Dec. 18) game against the Spurs.,2025-12-18
sarral01,Alex Sarr,WAS,Day To Day (Adductor) - Sarr did not play in Sunday's (Dec. 14) game against Indiana.,2025-12-18
