Player_ID,Player_Name,Team_Abbr,Note,Date_Fetched
nfalyda01,N'Faly Dante,ATL,"Out For Season (Knee) - Dante will undergo season-ending surgery to repair a torn ACL in his right knee, Michael Scotto of USA Today reports.",2026-01-07
youngtr01,Trae Young,ATL,Day To Day (Quad) - The Hawks listed Young as Questionable on Wednesday's (Jan. 7) game against the Pelicans.,2026-01-07
minotjo01,Josh Minott,BOS,Out (Ankle) - The Celtics listed Minott as OUT for Wednesday's (Jan. 7) game against Denver.,2026-01-07
tatumja01,Jayson Tatum,BOS,"Out (Achilles) - The Celtics have not ruled Tatum out for the 2025-26 season, ESPN's Shams Charania reported on the Pat McAfee Show on Thursday (Oct. 9).",2026-01-07
highsha01,Haywood Highsmith,BRK,"Out (Knee) - Highsmith has progressed to going through on-court work, but he's still not been cleared for full-contact, 5-on-5 drills, according to Erik Slater of ClutchPoints.com.",2026-01-07
sarafbe01,Ben Saraf,BRK,Out (Knee) - The Nets listed Saraf as Out on Wednesday's (Jan. 7) game against the Magic.,2026-01-07
diabamo01,Moussa Diabaté,CHO,Day To Day (Wrist) - The Hornets listed Diabate as probable for Wednesday's (Jan. 7) game against Toronto.,2026-01-07
kalkbry01,Ryan Kalkbrenner,CHO,Out (Elbow) - The Hornets listed Kalkbrenner as OUT for Wednesday's (Jan. 7) game against Toronto.,2026-01-07
millebr02,Brandon Miller,CHO,Day To Day (Knee) - The Hornets listed Miller as probable for Wednesday's (Jan. 7) game against Toronto.,2026-01-07
plumlma01,Mason Plumlee,CHO,"Out (Groin) - Plumlee underwent surgery to address his right groin injury and will be reevaluated in six weeks, the Hornets announced.",2026-01-07
salauti01,Tidjane Salaün,CHO,Day To Day (Ankle) - The Hornets listed Salaun as questionable for Wednesday's (Jan. 7) game against Toronto.,2026-01-07
willigr01,Grant Williams,CHO,Out (ACL) - Williams remains out as he recovers from knee surgery and is without a timetable for his return.,2026-01-07
buzelma01,Matas Buzelis,CHI,Day To Day (Illness) - The Bulls listed Buzelis as Questionable for Wednesday's (Jan. 7) game against Detroit.,2026-01-07
colliza01,Zach Collins,CHI,Out (Toe) - The Bulls listed Collins as OUT for Wednesday's (Jan. 7) game against Detroit.,2026-01-07
essenno01,Noa Essengue,CHI,"Out For Season (Shoulder) - The Bulls reported on Wednesday (Dec. 3) that Essengue will have shoulder surgery and miss the remainder of the season, per HC Billy Donovan.",2026-01-07
giddejo01,Josh Giddey,CHI,"Out (Hamstring) - Giddey is slated to miss at least a few weeks due to a left hamstring strain he sustained during Monday's loss to the Timberwolves, as per Shams Charania of ESPN.",2026-01-07
smithja04,Jalen Smith,CHI,Out (Concussion Protocol) - The Bulls listed Smith as OUT for Wednesday's (Jan. 7) game against Detroit.,2026-01-07
whiteco01,Coby White,CHI,Day To Day (Calf) - The Bulls listed White as Questionable for Wednesday's (Jan. 7) game against Detroit.,2026-01-07
nancela02,Larry Nance Jr.,CLE,Out (Calf) - The Cavaliers reported Nance Jr. to miss at least 3-4 weeks with a calf strain.,2026-01-07
strusma01,Max Strus,CLE,"Out (Foot) - Strus is no longer wearing a walking boot Tuesday (Sept. 30) but still has a lengthy recovery process ahead due to the surgery on his fractured left foot, per Chris Fedor of The Cleveland Plain Dealer.",2026-01-07
wadede01,Dean Wade,CLE,Day To Day (Knee) - Wade did not return to Tuesday's (Jan. 6) game against the Pacers.,2026-01-07
exumda01,Dante Exum,DAL,Out For Season (Knee) - The Mavericks announced on Friday (Nov. 21) that Exum will undergo season-ending knee surgery.,2026-01-07
irvinky01,Kyrie Irving,DAL,"Out (Knee) - Irving remains out indefinitely and doesn't have a return timetable, Mavericks reporter Grant Afseth said during an appearance on HoopsHype's podcast Around the Beat.",2026-01-07
livelde01,Dereck Lively II,DAL,Out For Season (Foot) - The Mavericks announced on Wednesday (Dec. 10) that Lively II will undergo season-ending foot surgery.,2026-01-07
washipj01,P.J. Washington,DAL,Day To Day (Ankle) - Washington did not play in Tuesday's (Jan. 6) game against Sacramento.,2026-01-07
batesta01,Tamar Bates,DEN,Out (Foot) - The Nuggets announced on Monday (Dec. 22) that Bates will be re-evaluated in 12 weeks.,2026-01-07
braunch01,Christian Braun,DEN,Day To Day (Ankle) - The Nuggets listed Braun as Questionable for Wednesday's (Jan. 7) game against Boston.,2026-01-07
gordoaa01,Aaron Gordon,DEN,Day To Day (Hamstring) - The Nuggets listed Gordon as Questionable for Wednesday's (Jan. 7) game against Boston.,2026-01-07
hardati02,Tim Hardaway Jr.,DEN,Day To Day (Illness Management) - The Nuggets listed Hardaway Jr. as Questionable for Wednesday's (Jan. 7) game against Boston.,2026-01-07
johnsca02,Cameron Johnson,DEN,Out (Knee) - The Nuggets said on Friday (Dec. 25) that Johnson is expected to miss at least 4-6 weeks.,2026-01-07
jokicni01,Nikola Jokić,DEN,"Out (Knee) - Jokic will miss at least four weeks with a hyperextended left knee, according to ESPN's Shams Charania reports.",2026-01-07
murraja01,Jamal Murray,DEN,Day To Day (Ankle) - The Nuggets listed Murray as Questionable for Wednesday's (Jan. 7) game against Boston.,2026-01-07
valanjo01,Jonas Valančiūnas,DEN,"Out (Calf) - Valanciunas will be re-evaluated in 4 weeks after sustaining a right calf strain in Wednesday's (Dec. 31) game in Toronto, according to Shams Charania of ESPN.",2026-01-07
cunnica01,Cade Cunningham,DET,Day To Day (Wrist) - The Pistons listed Cunningham as Probable for Wednesday's (Jun. 7) game against the Bulls.,2026-01-07
durenja01,Jalen Duren,DET,Out (Ankle) - The Pistons said on Saturday (Jan. 3) that Duren will miss at least 1 week.,2026-01-07
harrito02,Tobias Harris,DET,"Out (Hip) - Harris will be re-evaluated in two weeks, Omari Sankofa II of the Detroit Free Press reports.",2026-01-07
leverca01,Caris LeVert,DET,Day To Day (Knee) - The Pistons listed LeVert as Probable for Wednesday's (Jun. 7) game against Chicago.,2026-01-07
robindu01,Duncan Robinson,DET,Day To Day (Calf) - The Pistons listed Robinson as Probable for Wednesday's (Jun. 7) game against Chicago.,2026-01-07
curryse01,Seth Curry,GSW,"Out (Thigh) - The Warriors said Seth Curry to miss at least 2 weeks, per anthonyVslater.",2026-01-07
greendr01,Draymond Green,GSW,Day To Day (Ankle) - The Warriors listed Green as questionable for Wednesday's (Jan. 7) game against the Bucks.,2026-01-07
paytoga02,Gary Payton II,GSW,Day To Day (Ankle) - The Warriors listed Payton II as questionable for Wednesday's (Jan. 7) game against the Bucks.,2026-01-07
crawfis01,Isaiah Crawford,HOU,Out (Illness) - The Rockets listed Crawford as Out on Wednesday's (Jan. 7) game against the Trail Blazers.,2026-01-07
sengual01,Alperen Şengün,HOU,Out (Ankle) - The Rockets listed Sengun as Out on Wednesday's (Jan. 7) game against the Trail Blazers.,2026-01-07
vanvlfr01,Fred VanVleet,HOU,"Out For Season (ACL) - The Rockets said on Monday (Sept. 22) that VanVleet suffered a torn ACL and may be out for the entire 2025-26 campaign, per Shams Charania of ESPN.",2026-01-07
halibty01,Tyrese Haliburton,IND,Out For Season (Achilles) - The Pacers confirmed that Haliburton will miss the 2025-2026 season as he recovers from a torn Achilles.,2026-01-07
jacksis01,Isaiah Jackson,IND,Day To Day (Concussion) - Jackson did not play in Tuesday's (Jan. 6) game against Cleveland.,2026-01-07
mathube01,Bennedict Mathurin,IND,Out (Thumb) - The Pacers reported on Sunday (Jan. 4) that Mathurin has without a timetable for return.,2026-01-07
toppiob01,Obi Toppin,IND,Out (Foot) - The Pacers announced that Toppin will undergo foot surgery and miss at least three months.,2026-01-07
bealbr01,Bradley Beal,LAC,"Out For Season (Hip) - Beal will undergo season-ending surgery on his left hip, as per ESPN's Shams Charania reports.",2026-01-07
bogdabo01,Bogdan Bogdanović,LAC,"Out (Hamstring) - Bogdanovic won't return during the Clippers' current homestand and is without a timetable for a return ahead of the team's three-game road trip that begins against New York, according to Joey Linn of SI.com.",2026-01-07
hardeja01,James Harden,LAC,Day To Day (Shoulder) - The Clippers listed Harden as Questionable on Wednesday's (Jan. 7) game against the Knicks.,2026-01-07
jonesde02,Derrick Jones Jr.,LAC,"Out (Knee) - Derrick Jones Jr. has been diagnosed with a Grade 2 right MCL sprain and will be re-evaluated in 6 weeks, sources tell ESPN.",2026-01-07
hachiru01,Rui Hachimura,LAL,"Out (Calf) - Hachimura has been ruled out for Tuesday's game against the Pistons and will also miss the Lakers' two-game set against the Grizzlies on Friday and Sunday, per Dave McMenamin of ESPN.com.",2026-01-07
reaveau01,Austin Reaves,LAL,"Out (Calf) - Reaves has been diagnosed with a grade 2 left gastrocnemius strain and will be re-evaluated in approximately four weeks, Dan Woike of The Athletic reports.",2026-01-07
thierad01,Adou Thiero,LAL,"Out (Knee) - Thiero will miss at least four weeks with a right MCL sprain, according to Law Murray of The Athletic.",2026-01-07
vincega01,Gabe Vincent,LAL,Day To Day (Back) - Vincent did not play in Tuesday's (Jan. 6) game against New Orleans.,2026-01-07
clarkbr01,Brandon Clarke,MEM,Out (Calf) - Clarke has sustained a Grade 2 right calf strain and will be reevaluated in about three weeks.,2026-01-07
cowarce01,Cedric Coward,MEM,Day To Day (Ankle) - Coward did not play in Tuesday's (Jan. 6) game against San Antonio.,2026-01-07
edeyza01,Zach Edey,MEM,"Out (Ankle) - Edey will be re-evaluated in about four weeks, as per Shams Charania of ESPN.",2026-01-07
jeromty01,Ty Jerome,MEM,Out (Calf) - The Grizzlies said on Saturday (Nov. 22) that Jerome is expected to make his season debut within 6-9 weeks.,2026-01-07
konchjo01,John Konchar,MEM,Out (Thumb) - The Grizzlies announced Konchar underwent a successful procedure to repair a UCL tear in his left thumb. He is expected to make a full recovery and will be reevaluated in approximately three weeks.,2026-01-07
moranja01,Ja Morant,MEM,Day To Day (Calf) - Morant did not play in Tuesday's (Jan. 6) game against San Antonio.,2026-01-07
pippesc02,Scotty Pippen Jr.,MEM,Out (Toe) - The Grizzlies announced on Saturday (Oct. 18) that Pippen Jr. will undergo a procedure on his left big toe injury and will be re-evaluated in 12 weeks.,2026-01-07
jaqueja01,Jaime Jaquez Jr.,MIA,Day To Day (Ankle) - Jaquez Jr. did not play in Tuesday's (Jan. 6) game against Minnesota.,2026-01-07
princta02,Taurean Prince,MIL,Out (Neck) - The Team announce that Prince underwent surgery Thursday (Nov. 13) to repair the herniated disc in his neck and will remain out indefinitely.,2026-01-07
shannte01,Terrence Shannon Jr.,MIN,Day To Day (Foot) - Shannon Jr. did not play in Tuesday's (Jan. 6) game against Miami.,2026-01-07
beysa01,Saddiq Bey,NOP,Day To Day (Hip) - Bey did not play in Tuesday's (Jan. 6) game against the Lakers.,2026-01-07
murrade01,Dejounte Murray,NOP,"Out (Leg) - Pelicans interim head coach James Borrego said that Murray is working his tail off in his rehab, but the veteran point guard remains without a definitive target date for his 2025-26 debut, per Dylan Sanders of Roundtable.io.",2026-01-07
hartjo01,Josh Hart,NYK,Out (Ankle) - The Knick listed Hart as Out on Wednesday's (Jan. 7) game against the Clippers.,2026-01-07
shamela01,Landry Shamet,NYK,Out (Shoulder) - The Knick listed Shamet as Out on Wednesday's (Jan. 7) game against the Clippers.,2026-01-07
carusal01,Alex Caruso,OKC,Out (Back) - The Thunder listed Caruso as Out on Wednesday's (Jan. 7) game against the Jazz.,2026-01-07
diengou01,Ousmane Dieng,OKC,Out (Calf) - The Thunder listed Dieng as Out on Wednesday's (Jan. 7) game against the Jazz.,2026-01-07
harteis01,Isaiah Hartenstein,OKC,Out (Calf) - The Thunder listed Hartenstein as Out on Wednesday's (Jan. 7) game against the Jazz.,2026-01-07
sorbeth01,Thomas Sorber,OKC,Out For Season (Knee) - The Thunder announced on Friday (Sept. 5) that Sorber will miss the 2025-2026 season with a torn ACL.,2026-01-07
topicni01,Nikola Topić,OKC,Out (Groin) - The Thunder announced that Topic is dealing with testicular cancer and there is no timetable for his return.,2026-01-07
willija07,Jaylin Williams,OKC,Out (Heel) - The Thunder listed Williams as Out on Wednesday's (Jan. 7) game against the Jazz.,2026-01-07
suggsja01,Jalen Suggs,ORL,Day To Day (Knee) - Suggs did not play in Tuesday's (Jan. 6) game against Washington.,2026-01-07
wagnefr01,Franz Wagner,ORL,"Out (Ankle) - Head coach Jamahl Mosley said Monday that Wagner is without a timetable for a return to game action, as per Jason Beede of the Orlando Sentinel.",2026-01-07
wagnemo01,Moritz Wagner,ORL,"Out (Knee) - Wagner is expected to return within the next week, Philip Rossman-Reich of OrlandoMagicDaily.com reports.",2026-01-07
embiijo01,Joel Embiid,PHI,Day To Day (Ankle) - The 76ers listed Watford as Questionable on Wednesday's (Jan. 7) game against the Wizards.,2026-01-07
oubreke01,Kelly Oubre Jr.,PHI,Day To Day (Knee) - The 76ers listed Oubre as Questionable on Wednesday's (Jan. 7) game against the Wizards.,2026-01-07
watfotr01,Trendon Watford,PHI,Day To Day (Thigh) - The 76ers listed Watford as Questionable on Wednesday's (Jan. 7) game against the Wizards.,2026-01-07
bouyeja01,Jamaree Bouyea,PHO,Out (Concussion Protocol) - The Suns listed Bouyea as Out on Wednesday's (Jan. 7) game against the Grizzlies.,2026-01-07
greenja05,Jalen Green,PHO,"Out (Hamstring) - Green continues to make good progress in his recovery and will be re-evaluated in 2-to-3 weeks, Kellan Olson of ArizonaSports.com reports.",2026-01-07
grantje01,Jerami Grant,POR,Out (Achilles) - The Trail Blazers listed Grant as OUT for Wednesday's (Jan. 7) game against Houston.,2026-01-07
hendesc01,Scoot Henderson,POR,"Out (Hamstring) - Henderson will be re-evaluated in two weeks, as per Sean Highkin of Rip City Radio 620 Portland reports.",2026-01-07
holidjr01,Jrue Holiday,POR,Out (Calf) - The Trail Blazers listed Holiday as OUT for Wednesday's (Jan. 7) game against Houston.,2026-01-07
lillada01,Damian Lillard,POR,Out For Season (Achilles) - The Trail Blazers said on Thursday (Sept. 25) that Lillard won't be back on the court for the 2025-26 season due to his achilles injury.,2026-01-07
murrakr01,Kris Murray,POR,Day To Day (Back) - The Trail Blazers listed Murray as Doubtful for Wednesday's (Jan. 7) game against Houston.,2026-01-07
thybuma01,Matisse Thybulle,POR,Out (Thumb) - Portland announced Thursday that Thybulle is also dealing with right knee tendinopathy while also ramping up from thumb surgery.,2026-01-07
weslebl01,Blake Wesley,POR,"Out (Foot) - Wesley underwent a successful procedure to repair a fracture of the fifth metatarsal base in his right foot Wednesday (Nov. 5), and he's expected to be sidelined for 8-12 weeks, per Brett Siegel of ClutchPoints.com.",2026-01-07
murrake02,Keegan Murray,SAC,Out (Ankle) - The Kings reported Keegan Murray (ankle) to miss at least 3-4 weeks.,2026-01-07
sabondo01,Domantas Sabonis,SAC,Out (Knee) - Sabonis is expected to miss another 4-5 weeks according to reporter Marc Stein.,2026-01-07
vassede01,Devin Vassell,SAS,"Out (Thigh) - HC Mitch Johnson said prior to Wednesday's (Dec. 31) 134-132 win over the Knicks that Vassell's left adductor strain will keep him out for more than a game or two, as per Jeff McDonald of the San Antonio Express-News.",2026-01-07
poeltja01,Jakob Poeltl,TOR,Out (Back) - The Toronto Raptors listed Poeltl as OUT for Wednesday's (Jan. 7) game against Charlotte.,2026-01-07
baileac01,Ace Bailey,UTA,Day To Day (Hip) - The Jazz listed Bailey as Questionable on Wednesday's (Jan. 7) game against the Thunder.,2026-01-07
kesslwa01,Walker Kessler,UTA,"Out For Season (Shoulder) - Kessler will undergo left shoulder surgery to address a torn labrum and will miss the remainder of the 2025-26 season, as per Tony Jones of The Athletic.",2026-01-07
loveke01,Kevin Love,UTA,Out (Rest) - The Jazz listed Loveas Out on Wednesday's (Jan. 7) game against the Thunder.,2026-01-07
niangge01,Georges Niang,UTA,Out (Foot) - The Jazz announced Monday (Dec. 15) that Niang will be re-evaluated in two weeks.,2026-01-07
georgky01,Kyshawn George,WAS,Out (Hip) - The Wizards reported on Sunday (Jan. 4) that George has without a timetable for return.,2026-01-07
kispeco01,Corey Kispert,WAS,Day To Day (Hamstring) - Kispert did not play in Tuesday's (Jan. 6) game against Orlando.,2026-01-07
whitmca01,Cam Whitmore,WAS,"Out (Shoulder) - The Wizards said on Tuesday (Dec. 23) that Whitmore is out indefinitely after being diagnosed with upper-extremity deep vein thrombosis in his right shoulder, sources tell ESPN.",2026-01-07
